{
  "$schema": "../schemas/readiness-gates.schema.json",
  "schema_version": "1.0.0",
  "contract_status": "reference-architecture",
  "operational": false,
  "gates": [
    {"id": "platform.contracts-valid", "owner": "KALVIN", "class": "PLATFORM_READINESS", "external_application_gate": false, "purpose": "Selected declarations pass schema and cross-reference validation."},
    {"id": "repositories.resolved", "owner": "KALVIN", "class": "PLATFORM_READINESS", "external_application_gate": false, "purpose": "Every selected repository ref is bound to a verified immutable commit."},
    {"id": "configuration.complete", "owner": "KALVIN", "class": "PLATFORM_READINESS", "external_application_gate": false, "purpose": "Required non-secret configuration is present without conflicts."},
    {"id": "secrets.resolved", "owner": "KALVIN", "class": "PLATFORM_READINESS", "external_application_gate": false, "purpose": "Required external secret references resolve for only their intended consumers."},
    {"id": "selected-components.ready", "owner": "KALVIN", "class": "PLATFORM_READINESS", "external_application_gate": false, "purpose": "All selected required components satisfy their declared readiness gates."},
    {"id": "authoritative-state.ready", "owner": "APPLICATION_OWNERS", "class": "APPLICATION_READINESS", "external_application_gate": true, "purpose": "Selected authoritative state is mounted or restored consistently and passes owner checks."},
    {"id": "application.migrations-complete", "owner": "APPLICATION_OWNERS", "class": "APPLICATION_READINESS", "external_application_gate": true, "purpose": "Application-owned migrations and integrity checks completed for the resolved versions."},
    {"id": "application.authorization-validated", "owner": "APPLICATION_OWNERS", "class": "APPLICATION_READINESS", "external_application_gate": true, "purpose": "Authentication, retrieval/business authorization, and scoped service contracts pass."},
    {"id": "derived-state.reconciled", "owner": "APPLICATION_OWNERS", "class": "APPLICATION_READINESS", "external_application_gate": true, "purpose": "Derived indexes and caches are rebuilt or reconciled from authoritative state."},
    {"id": "backup.outbound-ready", "owner": "KALVIN", "class": "PLATFORM_READINESS", "external_application_gate": false, "purpose": "Core can submit consistent backup sets using a separate bounded backup identity."},
    {"id": "backup.pre-update-verified", "owner": "KALVIN", "class": "PLATFORM_READINESS", "external_application_gate": false, "purpose": "A policy-required rollback backup exists and verification evidence is current."},
    {"id": "storage.repository-ready", "owner": "KALVIN_STORAGE", "class": "STORAGE_READINESS", "external_application_gate": false, "purpose": "Backup repository integrity and capacity checks pass."},
    {"id": "storage.retention-ready", "owner": "KALVIN_STORAGE", "class": "STORAGE_READINESS", "external_application_gate": false, "purpose": "Reviewed retention and protected-copy policy is active."},
    {"id": "storage.restore-authorization-ready", "owner": "KALVIN_STORAGE", "class": "STORAGE_READINESS", "external_application_gate": false, "purpose": "Restore access is separate from backup submission and requires explicit authorization."},
    {"id": "identity.separation-validated", "owner": "KALVIN", "class": "PLATFORM_READINESS", "external_application_gate": false, "purpose": "Human, application, backup, monitoring, administration, and management identities remain distinct."},
    {"id": "exposure.policy-valid", "owner": "KALVIN", "class": "PLATFORM_READINESS", "external_application_gate": false, "purpose": "Selected exposure is explicit and within component and profile limits."},
    {"id": "kal.health", "owner": "KAL", "class": "SELF_HEALTH", "external_application_gate": true, "purpose": "Kal's bounded self-health contract passes."},
    {"id": "kal.rag-status-durable", "owner": "KAL", "class": "APPLICATION_READINESS", "external_application_gate": true, "purpose": "RAG indexing status is durable across restart and reconciliation behavior is validated."},
    {"id": "beepy.health", "owner": "BEEPY", "class": "SELF_HEALTH", "external_application_gate": true, "purpose": "Beepy's bounded self-health contract passes."},
    {"id": "model-runtime.health", "owner": "SELECTED_PROVIDER", "class": "SELF_HEALTH", "external_application_gate": true, "purpose": "The selected model-runtime implementation satisfies its bounded capability health contract."},
    {"id": "monitoring.health", "owner": "KALVIN", "class": "SELF_HEALTH", "external_application_gate": false, "purpose": "Monitoring collection operates without exposing sensitive values."},
    {"id": "backup-client.health", "owner": "KALVIN", "class": "SELF_HEALTH", "external_application_gate": false, "purpose": "The outbound backup client can perform its bounded function."},
    {"id": "storage-backup-target.health", "owner": "KALVIN_STORAGE", "class": "SELF_HEALTH", "external_application_gate": false, "purpose": "The backup target service is functioning independently of restore authorization."},
    {"id": "network-overlay.health", "owner": "SELECTED_PROVIDER", "class": "OPTIONAL_INTEGRATION_READINESS", "external_application_gate": true, "purpose": "An explicitly selected private overlay transport is healthy."},
    {"id": "legacy-open-webui-compatibility.health", "owner": "SELECTED_PROVIDER", "class": "OPTIONAL_INTEGRATION_READINESS", "external_application_gate": true, "purpose": "The explicitly enabled legacy UI compatibility integration is bounded and healthy."},
    {"id": "public-test-exposure.health", "owner": "SELECTED_PROVIDER", "class": "OPTIONAL_INTEGRATION_READINESS", "external_application_gate": true, "purpose": "The explicitly approved temporary lab exposure integration is healthy and authenticated."}
  ]
}
